{
  "$schema": "https://json-schema.org/draft/2020-12/schema",
  "$id": "https://dediren.dev/schemas/layout-result.schema.json",
  "type": "object",
  "additionalProperties": false,
  "required": ["layout_result_schema_version", "view_id", "nodes", "edges", "groups", "warnings"],
  "properties": {
    "layout_result_schema_version": { "const": "layout-result.schema.v3" },
    "view_id": { "type": "string" },
    "nodes": { "type": "array", "items": { "$ref": "#/$defs/node" } },
    "edges": { "type": "array", "items": { "$ref": "#/$defs/edge" } },
    "groups": { "type": "array", "items": { "$ref": "#/$defs/group" } },
    "warnings": { "type": "array", "items": { "$ref": "#/$defs/diagnostic" } }
  },
  "$defs": {
    "node": {
      "type": "object",
      "additionalProperties": false,
      "required": ["id", "source_id", "projection_id", "x", "y", "width", "height", "label"],
      "properties": {
        "id": { "type": "string" },
        "source_id": { "type": "string" },
        "projection_id": { "type": "string" },
        "x": { "type": "number" },
        "y": { "type": "number" },
        "width": { "type": "number", "exclusiveMinimum": 0 },
        "height": { "type": "number", "exclusiveMinimum": 0 },
        "label": { "type": "string" },
        "role": { "enum": ["lifeline", "interaction", "junction", "execution", "destruction"] },
        "source_pointer": { "type": "string", "pattern": "^/" }
      }
    },
    "edge": {
      "type": "object",
      "additionalProperties": false,
      "required": ["id", "source", "target", "source_id", "projection_id", "route", "label"],
      "properties": {
        "id": { "type": "string" },
        "source": { "type": "string" },
        "target": { "type": "string" },
        "source_id": { "type": "string" },
        "projection_id": { "type": "string" },
        "routing_hints": {
          "type": "array",
          "items": {
            "enum": ["shared_source_junction", "shared_target_junction"]
          }
        },
        "route": { "$ref": "#/$defs/route" },
        "label": { "type": "string" },
        "source_pointer": { "type": "string", "pattern": "^/" }
      }
    },
    "group": {
      "type": "object",
      "additionalProperties": false,
      "required": ["id", "source_id", "projection_id", "x", "y", "width", "height", "members", "label"],
      "properties": {
        "id": { "type": "string" },
        "source_id": { "type": "string" },
        "projection_id": { "type": "string" },
        "provenance": {
          "oneOf": [
            {
              "type": "object",
              "additionalProperties": false,
              "required": ["visual_only"],
              "properties": {
                "visual_only": { "const": true }
              }
            },
            {
              "type": "object",
              "additionalProperties": false,
              "required": ["semantic_backed"],
              "properties": {
                "semantic_backed": {
                  "type": "object",
                  "additionalProperties": false,
                  "required": ["source_id"],
                  "properties": {
                    "source_id": { "type": "string", "minLength": 1 }
                  }
                }
              }
            }
          ]
        },
        "x": { "type": "number" },
        "y": { "type": "number" },
        "width": { "type": "number", "exclusiveMinimum": 0 },
        "height": { "type": "number", "exclusiveMinimum": 0 },
        "members": { "type": "array", "items": { "type": "string" } },
        "label": { "type": "string" }
      }
    },
    "point": {
      "type": "object",
      "additionalProperties": false,
      "required": ["x", "y"],
      "properties": {
        "x": { "type": "number" },
        "y": { "type": "number" }
      }
    },
    "route": {
      "oneOf": [
        { "$ref": "#/$defs/polyline_route" },
        { "$ref": "#/$defs/cubic_bezier_route" }
      ]
    },
    "polyline_route": {
      "type": "object",
      "additionalProperties": false,
      "required": ["kind", "points"],
      "properties": {
        "kind": { "const": "polyline" },
        "points": { "type": "array", "items": { "$ref": "#/$defs/point" } }
      }
    },
    "cubic_bezier_route": {
      "type": "object",
      "additionalProperties": false,
      "required": ["kind", "start", "segments"],
      "properties": {
        "kind": { "const": "cubic_bezier" },
        "start": { "$ref": "#/$defs/point" },
        "segments": {
          "type": "array",
          "items": { "$ref": "#/$defs/cubic_bezier_segment" }
        }
      }
    },
    "cubic_bezier_segment": {
      "type": "object",
      "additionalProperties": false,
      "required": ["control1", "control2", "end"],
      "properties": {
        "control1": { "$ref": "#/$defs/point" },
        "control2": { "$ref": "#/$defs/point" },
        "end": { "$ref": "#/$defs/point" }
      }
    },
    "diagnostic": {
      "type": "object",
      "additionalProperties": false,
      "required": ["code", "severity", "message"],
      "properties": {
        "code": { "type": "string" },
        "severity": { "enum": ["info", "warning", "error"] },
        "message": { "type": "string" },
        "path": { "type": "string" },
        "source_pointer": { "type": "string", "pattern": "^/" }
      }
    }
  }
}
