{
  "layout_result_schema_version" : "layout-result.schema.v3",
  "view_id" : "state-machine-two-node-cycle-view",
  "nodes" : [ {
    "id" : "idle",
    "source_id" : "idle",
    "projection_id" : "idle",
    "x" : 76.0,
    "y" : 76.0,
    "width" : 150.0,
    "height" : 72.0,
    "label" : "Idle",
    "source_pointer" : "/nodes/2"
  }, {
    "id" : "engaged",
    "source_id" : "engaged",
    "projection_id" : "engaged",
    "x" : 373.0,
    "y" : 292.0,
    "width" : 150.0,
    "height" : 72.0,
    "label" : "Engaged",
    "source_pointer" : "/nodes/3"
  } ],
  "edges" : [ {
    "id" : "t-engage",
    "source" : "idle",
    "target" : "engaged",
    "source_id" : "t-engage",
    "projection_id" : "t-engage",
    "routing_hints" : [ ],
    "route" : {
      "kind" : "polyline",
      "points" : [ {
        "x" : 227.0,
        "y" : 103.83333333333333
      }, {
        "x" : 324.0,
        "y" : 103.83333333333333
      }, {
        "x" : 324.0,
        "y" : 336.1666666666667
      }, {
        "x" : 372.0,
        "y" : 336.1666666666667
      } ]
    },
    "label" : "engage",
    "source_pointer" : "/relationships/0"
  }, {
    "id" : "t-disengage",
    "source" : "engaged",
    "target" : "idle",
    "source_id" : "t-disengage",
    "projection_id" : "t-disengage",
    "routing_hints" : [ ],
    "route" : {
      "kind" : "polyline",
      "points" : [ {
        "x" : 372.0,
        "y" : 319.83333333333337
      }, {
        "x" : 275.0,
        "y" : 319.83333333333337
      }, {
        "x" : 275.0,
        "y" : 120.16666666666666
      }, {
        "x" : 227.0,
        "y" : 120.16666666666666
      } ]
    },
    "label" : "disengage",
    "source_pointer" : "/relationships/1"
  } ],
  "groups" : [ {
    "id" : "two-node-machine-frame",
    "source_id" : "session-machine",
    "projection_id" : "two-node-machine-frame",
    "provenance" : {
      "semantic_backed" : {
        "source_id" : "session-machine"
      }
    },
    "x" : 12.0,
    "y" : 12.0,
    "width" : 575.0,
    "height" : 416.0,
    "members" : [ "two-node-region-frame" ],
    "label" : "Session Lifecycle"
  }, {
    "id" : "two-node-region-frame",
    "source_id" : "session-region",
    "projection_id" : "two-node-region-frame",
    "provenance" : {
      "semantic_backed" : {
        "source_id" : "session-region"
      }
    },
    "x" : 44.0,
    "y" : 44.0,
    "width" : 511.0,
    "height" : 352.0,
    "members" : [ "idle", "engaged" ],
    "label" : "Session Region"
  } ],
  "warnings" : [ ]
}
