{
  "layout_result_schema_version" : "layout-result.schema.v3",
  "view_id" : "sequence-view",
  "nodes" : [ {
    "id" : "interaction-lifecycle",
    "source_id" : "interaction-lifecycle",
    "projection_id" : "interaction-lifecycle",
    "x" : 517.0,
    "y" : 12.0,
    "width" : 612.0,
    "height" : 203.5,
    "label" : "Worker Lifecycle",
    "role" : "interaction",
    "source_pointer" : "/nodes/0"
  }, {
    "id" : "customer",
    "source_id" : "customer",
    "projection_id" : "customer",
    "x" : 517.0,
    "y" : 12.0,
    "width" : 140.0,
    "height" : 64.0,
    "label" : "Customer",
    "role" : "lifeline",
    "source_pointer" : "/nodes/1"
  }, {
    "id" : "service",
    "source_id" : "service",
    "projection_id" : "service",
    "x" : 753.0,
    "y" : 12.0,
    "width" : 140.0,
    "height" : 64.0,
    "label" : "Order Service",
    "role" : "lifeline",
    "source_pointer" : "/nodes/2"
  }, {
    "id" : "worker",
    "source_id" : "worker",
    "projection_id" : "worker",
    "x" : 989.0,
    "y" : 12.0,
    "width" : 140.0,
    "height" : 64.0,
    "label" : "Worker",
    "role" : "lifeline",
    "source_pointer" : "/nodes/3"
  }, {
    "id" : "exec-service",
    "source_id" : "exec-service",
    "projection_id" : "exec-service",
    "x" : 815.0,
    "y" : 100.0,
    "width" : 16.0,
    "height" : 96.0,
    "label" : "Order Service Activation",
    "role" : "execution",
    "source_pointer" : "/nodes/4"
  }, {
    "id" : "worker-destroyed",
    "source_id" : "worker-destroyed",
    "projection_id" : "worker-destroyed",
    "x" : 1047.0,
    "y" : 112.5,
    "width" : 24.0,
    "height" : 103.0,
    "label" : "Worker Destroyed",
    "role" : "destruction",
    "source_pointer" : "/nodes/5"
  } ],
  "edges" : [ {
    "id" : "m1",
    "source" : "customer",
    "target" : "service",
    "source_id" : "m1",
    "projection_id" : "m1",
    "routing_hints" : [ ],
    "route" : {
      "kind" : "polyline",
      "points" : [ {
        "x" : 587.0,
        "y" : 100.0
      }, {
        "x" : 823.0,
        "y" : 100.0
      } ]
    },
    "label" : "placeOrder",
    "source_pointer" : "/relationships/0"
  }, {
    "id" : "m2",
    "source" : "service",
    "target" : "worker",
    "source_id" : "m2",
    "projection_id" : "m2",
    "routing_hints" : [ ],
    "route" : {
      "kind" : "polyline",
      "points" : [ {
        "x" : 823.0,
        "y" : 132.0
      }, {
        "x" : 1059.0,
        "y" : 132.0
      } ]
    },
    "label" : "createWorker",
    "source_pointer" : "/relationships/1"
  }, {
    "id" : "m3",
    "source" : "service",
    "target" : "worker-destroyed",
    "source_id" : "m3",
    "projection_id" : "m3",
    "routing_hints" : [ ],
    "route" : {
      "kind" : "polyline",
      "points" : [ {
        "x" : 823.0,
        "y" : 164.0
      }, {
        "x" : 1047.0,
        "y" : 164.0
      } ]
    },
    "label" : "destroyWorker",
    "source_pointer" : "/relationships/2"
  }, {
    "id" : "m4",
    "source" : "service",
    "target" : "customer",
    "source_id" : "m4",
    "projection_id" : "m4",
    "routing_hints" : [ ],
    "route" : {
      "kind" : "polyline",
      "points" : [ {
        "x" : 823.0,
        "y" : 196.0
      }, {
        "x" : 587.0,
        "y" : 196.0
      } ]
    },
    "label" : "orderComplete",
    "source_pointer" : "/relationships/3"
  } ],
  "groups" : [ ],
  "warnings" : [ ]
}
