{
  "layout_result_schema_version" : "layout-result.schema.v3",
  "view_id" : "use-case-view",
  "nodes" : [ {
    "id" : "customer",
    "source_id" : "customer",
    "projection_id" : "customer",
    "x" : 12.0,
    "y" : 205.5,
    "width" : 80.0,
    "height" : 120.0,
    "label" : "Customer",
    "source_pointer" : "/nodes/1"
  }, {
    "id" : "support-agent",
    "source_id" : "support-agent",
    "projection_id" : "support-agent",
    "x" : 12.0,
    "y" : 470.0,
    "width" : 80.0,
    "height" : 120.0,
    "label" : "Support Agent",
    "source_pointer" : "/nodes/2"
  }, {
    "id" : "place-order",
    "source_id" : "place-order",
    "projection_id" : "place-order",
    "x" : 551.0,
    "y" : 297.0,
    "width" : 160.0,
    "height" : 72.0,
    "label" : "Place Order",
    "source_pointer" : "/nodes/3"
  }, {
    "id" : "track-order",
    "source_id" : "track-order",
    "projection_id" : "track-order",
    "x" : 246.0,
    "y" : 213.0,
    "width" : 160.0,
    "height" : 72.0,
    "label" : "Track Order",
    "source_pointer" : "/nodes/4"
  }, {
    "id" : "authenticate-customer",
    "source_id" : "authenticate-customer",
    "projection_id" : "authenticate-customer",
    "x" : 855.0,
    "y" : 467.0,
    "width" : 160.0,
    "height" : 72.0,
    "label" : "Authenticate Customer",
    "source_pointer" : "/nodes/5"
  }, {
    "id" : "apply-discount",
    "source_id" : "apply-discount",
    "projection_id" : "apply-discount",
    "x" : 245.5,
    "y" : 44.0,
    "width" : 160.0,
    "height" : 72.0,
    "label" : "Apply Discount",
    "source_pointer" : "/nodes/6"
  }, {
    "id" : "cancel-order",
    "source_id" : "cancel-order",
    "projection_id" : "cancel-order",
    "x" : 246.0,
    "y" : 494.0,
    "width" : 160.0,
    "height" : 72.0,
    "label" : "Cancel Order",
    "source_pointer" : "/nodes/7"
  }, {
    "id" : "payment-extension",
    "source_id" : "payment-extension",
    "projection_id" : "payment-extension",
    "x" : 255.5,
    "y" : 382.0,
    "width" : 140.0,
    "height" : 40.0,
    "label" : "payment authorized",
    "source_pointer" : "/nodes/8"
  } ],
  "edges" : [ {
    "id" : "customer-place-order",
    "source" : "customer",
    "target" : "place-order",
    "source_id" : "customer-place-order",
    "projection_id" : "customer-place-order",
    "routing_hints" : [ ],
    "route" : {
      "kind" : "polyline",
      "points" : [ {
        "x" : 93.0,
        "y" : 282.0
      }, {
        "x" : 141.0,
        "y" : 282.0
      }, {
        "x" : 141.0,
        "y" : 333.0
      }, {
        "x" : 550.0,
        "y" : 333.0
      } ]
    },
    "label" : "",
    "source_pointer" : "/relationships/0"
  }, {
    "id" : "customer-track-order",
    "source" : "customer",
    "target" : "track-order",
    "source_id" : "customer-track-order",
    "projection_id" : "customer-track-order",
    "routing_hints" : [ ],
    "route" : {
      "kind" : "polyline",
      "points" : [ {
        "x" : 93.0,
        "y" : 249.0
      }, {
        "x" : 245.0,
        "y" : 249.0
      } ]
    },
    "label" : "",
    "source_pointer" : "/relationships/1"
  }, {
    "id" : "support-cancel-order",
    "source" : "support-agent",
    "target" : "cancel-order",
    "source_id" : "support-cancel-order",
    "projection_id" : "support-cancel-order",
    "routing_hints" : [ ],
    "route" : {
      "kind" : "polyline",
      "points" : [ {
        "x" : 93.0,
        "y" : 530.0
      }, {
        "x" : 245.0,
        "y" : 530.0
      } ]
    },
    "label" : "",
    "source_pointer" : "/relationships/2"
  }, {
    "id" : "include-authentication",
    "source" : "place-order",
    "target" : "authenticate-customer",
    "source_id" : "include-authentication",
    "projection_id" : "include-authentication",
    "routing_hints" : [ ],
    "route" : {
      "kind" : "polyline",
      "points" : [ {
        "x" : 631.0,
        "y" : 370.0
      }, {
        "x" : 631.0,
        "y" : 418.0
      }, {
        "x" : 935.0,
        "y" : 418.0
      }, {
        "x" : 935.0,
        "y" : 466.0
      } ]
    },
    "label" : "include",
    "source_pointer" : "/relationships/3"
  }, {
    "id" : "extend-discount",
    "source" : "apply-discount",
    "target" : "place-order",
    "source_id" : "extend-discount",
    "projection_id" : "extend-discount",
    "routing_hints" : [ ],
    "route" : {
      "kind" : "polyline",
      "points" : [ {
        "x" : 325.5,
        "y" : 117.0
      }, {
        "x" : 325.5,
        "y" : 165.0
      }, {
        "x" : 631.0,
        "y" : 165.0
      }, {
        "x" : 631.0,
        "y" : 296.0
      } ]
    },
    "label" : "extend",
    "source_pointer" : "/relationships/4"
  } ],
  "groups" : [ {
    "id" : "order-service-boundary",
    "source_id" : "order-service",
    "projection_id" : "order-service-boundary",
    "provenance" : {
      "semantic_backed" : {
        "source_id" : "order-service"
      }
    },
    "x" : 213.0,
    "y" : 12.0,
    "width" : 834.0,
    "height" : 586.0,
    "members" : [ "place-order", "track-order", "authenticate-customer", "apply-discount", "cancel-order", "payment-extension" ],
    "label" : "Order Service"
  } ],
  "warnings" : [ ]
}
