{
  "layout_result_schema_version" : "layout-result.schema.v3",
  "view_id" : "compact-side-return",
  "nodes" : [ {
    "id" : "continue-decision",
    "source_id" : "continue-decision",
    "projection_id" : "continue-decision",
    "x" : 76.0,
    "y" : 12.0,
    "width" : 32.0,
    "height" : 32.0,
    "label" : "Continue?",
    "source_pointer" : "/nodes/0"
  }, {
    "id" : "take-action",
    "source_id" : "take-action",
    "projection_id" : "take-action",
    "x" : 12.0,
    "y" : 215.25,
    "width" : 160.0,
    "height" : 80.0,
    "label" : "Take action",
    "source_pointer" : "/nodes/1"
  }, {
    "id" : "resume",
    "source_id" : "resume",
    "projection_id" : "resume",
    "x" : 12.0,
    "y" : 369.25,
    "width" : 160.0,
    "height" : 80.0,
    "label" : "Resume",
    "source_pointer" : "/nodes/2"
  }, {
    "id" : "done",
    "source_id" : "done",
    "projection_id" : "done",
    "x" : 76.0,
    "y" : 523.25,
    "width" : 32.0,
    "height" : 32.0,
    "label" : "",
    "source_pointer" : "/nodes/3"
  } ],
  "edges" : [ {
    "id" : "continue-yes",
    "source" : "continue-decision",
    "target" : "take-action",
    "source_id" : "continue-yes",
    "projection_id" : "continue-yes",
    "routing_hints" : [ ],
    "route" : {
      "kind" : "polyline",
      "points" : [ {
        "x" : 92.0,
        "y" : 45.0
      }, {
        "x" : 92.0,
        "y" : 214.25
      } ]
    },
    "label" : "yes",
    "source_pointer" : "/relationships/0"
  }, {
    "id" : "continue-no",
    "source" : "continue-decision",
    "target" : "done",
    "source_id" : "continue-no",
    "projection_id" : "continue-no",
    "routing_hints" : [ ],
    "route" : {
      "kind" : "polyline",
      "points" : [ {
        "x" : 109.0,
        "y" : 28.0
      }, {
        "x" : 244.0,
        "y" : 28.0
      }, {
        "x" : 244.0,
        "y" : 539.25
      }, {
        "x" : 109.0,
        "y" : 539.25
      } ]
    },
    "label" : "no",
    "source_pointer" : "/relationships/1"
  }, {
    "id" : "action-resume",
    "source" : "take-action",
    "target" : "resume",
    "source_id" : "action-resume",
    "projection_id" : "action-resume",
    "routing_hints" : [ ],
    "route" : {
      "kind" : "polyline",
      "points" : [ {
        "x" : 92.0,
        "y" : 296.25
      }, {
        "x" : 92.0,
        "y" : 368.25
      } ]
    },
    "label" : "",
    "source_pointer" : "/relationships/2"
  }, {
    "id" : "resume-done",
    "source" : "resume",
    "target" : "done",
    "source_id" : "resume-done",
    "projection_id" : "resume-done",
    "routing_hints" : [ ],
    "route" : {
      "kind" : "polyline",
      "points" : [ {
        "x" : 92.0,
        "y" : 450.25
      }, {
        "x" : 92.0,
        "y" : 522.25
      } ]
    },
    "label" : "",
    "source_pointer" : "/relationships/3"
  } ],
  "groups" : [ ],
  "warnings" : [ ]
}
