{
  "layout_result_schema_version" : "layout-result.schema.v3",
  "view_id" : "main",
  "nodes" : [ {
    "id" : "client",
    "source_id" : "client",
    "projection_id" : "client",
    "x" : 12.0,
    "y" : 12.0,
    "width" : 160.0,
    "height" : 80.0,
    "label" : "Client",
    "source_pointer" : "/nodes/0"
  }, {
    "id" : "api",
    "source_id" : "api",
    "projection_id" : "api",
    "x" : 254.0,
    "y" : 12.0,
    "width" : 160.0,
    "height" : 80.0,
    "label" : "API",
    "source_pointer" : "/nodes/1"
  } ],
  "edges" : [ {
    "id" : "client-calls-api",
    "source" : "client",
    "target" : "api",
    "source_id" : "client-calls-api",
    "projection_id" : "client-calls-api",
    "routing_hints" : [ ],
    "route" : {
      "kind" : "polyline",
      "points" : [ {
        "x" : 173.0,
        "y" : 52.0
      }, {
        "x" : 253.0,
        "y" : 52.0
      } ]
    },
    "label" : "calls",
    "source_pointer" : "/relationships/0"
  } ],
  "groups" : [ ],
  "warnings" : [ ]
}
