{
  "layout_result_schema_version" : "layout-result.schema.v3",
  "view_id" : "sequence-view",
  "nodes" : [ {
    "id" : "interaction-place-order",
    "source_id" : "interaction-place-order",
    "projection_id" : "interaction-place-order",
    "x" : 141.0,
    "y" : 292.0,
    "width" : 424.0,
    "height" : 152.0,
    "label" : "Place Order",
    "role" : "interaction",
    "source_pointer" : "/nodes/0"
  }, {
    "id" : "customer",
    "source_id" : "customer",
    "projection_id" : "customer",
    "x" : 141.0,
    "y" : 292.0,
    "width" : 140.0,
    "height" : 64.0,
    "label" : "Customer",
    "role" : "lifeline",
    "source_pointer" : "/nodes/1"
  }, {
    "id" : "service",
    "source_id" : "service",
    "projection_id" : "service",
    "x" : 425.0,
    "y" : 292.0,
    "width" : 140.0,
    "height" : 64.0,
    "label" : "Order Service",
    "role" : "lifeline",
    "source_pointer" : "/nodes/2"
  } ],
  "edges" : [ {
    "id" : "m1",
    "source" : "customer",
    "target" : "service",
    "source_id" : "m1",
    "projection_id" : "m1",
    "routing_hints" : [ ],
    "route" : {
      "kind" : "polyline",
      "points" : [ {
        "x" : 211.0,
        "y" : 380.0
      }, {
        "x" : 495.0,
        "y" : 380.0
      } ]
    },
    "label" : "placeOrder",
    "source_pointer" : "/relationships/0"
  }, {
    "id" : "m2",
    "source" : "service",
    "target" : "customer",
    "source_id" : "m2",
    "projection_id" : "m2",
    "routing_hints" : [ ],
    "route" : {
      "kind" : "polyline",
      "points" : [ {
        "x" : 495.0,
        "y" : 412.0
      }, {
        "x" : 211.0,
        "y" : 412.0
      } ]
    },
    "label" : "accepted",
    "source_pointer" : "/relationships/1"
  }, {
    "id" : "m3",
    "source" : "service",
    "target" : "customer",
    "source_id" : "m3",
    "projection_id" : "m3",
    "routing_hints" : [ ],
    "route" : {
      "kind" : "polyline",
      "points" : [ {
        "x" : 495.0,
        "y" : 444.0
      }, {
        "x" : 211.0,
        "y" : 444.0
      } ]
    },
    "label" : "receiptReady",
    "source_pointer" : "/relationships/2"
  } ],
  "groups" : [ ],
  "warnings" : [ ]
}
