{
  "layout_result_schema_version" : "layout-result.schema.v3",
  "view_id" : "component-view",
  "nodes" : [ {
    "id" : "component-order-api",
    "source_id" : "component-order-api",
    "projection_id" : "component-order-api",
    "x" : 76.0,
    "y" : 76.0,
    "width" : 180.0,
    "height" : 185.0,
    "label" : "Order API",
    "source_pointer" : "/nodes/1"
  }, {
    "id" : "port-rest-api",
    "source_id" : "port-rest-api",
    "projection_id" : "port-rest-api",
    "x" : 150.5,
    "y" : 333.0,
    "width" : 32.0,
    "height" : 32.0,
    "label" : "REST",
    "source_pointer" : "/nodes/2"
  }, {
    "id" : "component-payment-adapter",
    "source_id" : "component-payment-adapter",
    "projection_id" : "component-payment-adapter",
    "x" : 76.0,
    "y" : 605.0,
    "width" : 180.0,
    "height" : 103.0,
    "label" : "Payment Adapter",
    "source_pointer" : "/nodes/3"
  }, {
    "id" : "port-payment-client",
    "source_id" : "port-payment-client",
    "projection_id" : "port-payment-client",
    "x" : 150.5,
    "y" : 501.0,
    "width" : 32.0,
    "height" : 32.0,
    "label" : "client",
    "source_pointer" : "/nodes/4"
  }, {
    "id" : "interface-order-api",
    "source_id" : "interface-order-api",
    "projection_id" : "interface-order-api",
    "x" : 609.052978515625,
    "y" : 259.5,
    "width" : 280.0,
    "height" : 120.0,
    "label" : "OrderApi",
    "source_pointer" : "/nodes/5"
  }, {
    "id" : "interface-payment-gateway",
    "source_id" : "interface-payment-gateway",
    "projection_id" : "interface-payment-gateway",
    "x" : 609.052978515625,
    "y" : 451.5,
    "width" : 320.0,
    "height" : 144.0,
    "label" : "PaymentGateway",
    "source_pointer" : "/nodes/6"
  }, {
    "id" : "class-order-controller",
    "source_id" : "class-order-controller",
    "projection_id" : "class-order-controller",
    "x" : 609.052978515625,
    "y" : 67.5,
    "width" : 240.0,
    "height" : 120.0,
    "label" : "OrderController",
    "source_pointer" : "/nodes/7"
  } ],
  "edges" : [ {
    "id" : "order-api-realizes-order-api",
    "source" : "component-order-api",
    "target" : "interface-order-api",
    "source_id" : "order-api-realizes-order-api",
    "projection_id" : "order-api-realizes-order-api",
    "routing_hints" : [ ],
    "route" : {
      "kind" : "polyline",
      "points" : [ {
        "x" : 257.0,
        "y" : 168.5
      }, {
        "x" : 401.0,
        "y" : 168.5
      }, {
        "x" : 401.0,
        "y" : 319.5
      }, {
        "x" : 608.052978515625,
        "y" : 319.5
      } ]
    },
    "label" : "realizes",
    "source_pointer" : "/relationships/0"
  }, {
    "id" : "order-api-uses-payment",
    "source" : "component-order-api",
    "target" : "interface-payment-gateway",
    "source_id" : "order-api-uses-payment",
    "projection_id" : "order-api-uses-payment",
    "routing_hints" : [ ],
    "route" : {
      "kind" : "polyline",
      "points" : [ {
        "x" : 257.0,
        "y" : 209.5
      }, {
        "x" : 361.0,
        "y" : 209.5
      }, {
        "x" : 361.0,
        "y" : 503.0
      }, {
        "x" : 608.052978515625,
        "y" : 503.0
      } ]
    },
    "label" : "uses",
    "source_pointer" : "/relationships/1"
  }, {
    "id" : "payment-adapter-realizes-gateway",
    "source" : "component-payment-adapter",
    "target" : "interface-payment-gateway",
    "source_id" : "payment-adapter-realizes-gateway",
    "projection_id" : "payment-adapter-realizes-gateway",
    "routing_hints" : [ ],
    "route" : {
      "kind" : "polyline",
      "points" : [ {
        "x" : 257.0,
        "y" : 656.5
      }, {
        "x" : 560.0530090332031,
        "y" : 656.5
      }, {
        "x" : 560.0530090332031,
        "y" : 544.0
      }, {
        "x" : 608.052978515625,
        "y" : 544.0
      } ]
    },
    "label" : "realizes",
    "source_pointer" : "/relationships/2"
  }, {
    "id" : "order-api-depends-controller",
    "source" : "component-order-api",
    "target" : "class-order-controller",
    "source_id" : "order-api-depends-controller",
    "projection_id" : "order-api-depends-controller",
    "routing_hints" : [ ],
    "route" : {
      "kind" : "polyline",
      "points" : [ {
        "x" : 257.0,
        "y" : 127.5
      }, {
        "x" : 608.052978515625,
        "y" : 127.5
      } ]
    },
    "label" : "uses",
    "source_pointer" : "/relationships/3"
  } ],
  "groups" : [ {
    "id" : "orders-package-boundary",
    "source_id" : "pkg-orders",
    "projection_id" : "orders-package-boundary",
    "provenance" : {
      "semantic_backed" : {
        "source_id" : "pkg-orders"
      }
    },
    "x" : 12.0,
    "y" : 12.0,
    "width" : 949.052978515625,
    "height" : 760.0,
    "members" : [ "order-api-boundary", "payment-adapter-boundary", "interface-order-api", "interface-payment-gateway", "class-order-controller" ],
    "label" : "Orders"
  }, {
    "id" : "order-api-boundary",
    "source_id" : "component-order-api",
    "projection_id" : "order-api-boundary",
    "provenance" : {
      "semantic_backed" : {
        "source_id" : "component-order-api"
      }
    },
    "x" : 44.0,
    "y" : 44.0,
    "width" : 245.0,
    "height" : 353.0,
    "members" : [ "component-order-api", "port-rest-api" ],
    "label" : "Order API"
  }, {
    "id" : "payment-adapter-boundary",
    "source_id" : "component-payment-adapter",
    "projection_id" : "payment-adapter-boundary",
    "provenance" : {
      "semantic_backed" : {
        "source_id" : "component-payment-adapter"
      }
    },
    "x" : 44.0,
    "y" : 469.0,
    "width" : 245.0,
    "height" : 271.0,
    "members" : [ "component-payment-adapter", "port-payment-client" ],
    "label" : "Payment Adapter"
  } ],
  "warnings" : [ ]
}
