{
  "layout_result_schema_version" : "layout-result.schema.v3",
  "view_id" : "class-view",
  "nodes" : [ {
    "id" : "pkg-orders",
    "source_id" : "pkg-orders",
    "projection_id" : "pkg-orders",
    "x" : 290.26239013671875,
    "y" : 460.0,
    "width" : 160.0,
    "height" : 80.0,
    "label" : "Orders",
    "source_pointer" : "/nodes/0"
  }, {
    "id" : "class-order",
    "source_id" : "class-order",
    "projection_id" : "class-order",
    "x" : 44.0,
    "y" : 52.5,
    "width" : 220.0,
    "height" : 144.0,
    "label" : "Order",
    "source_pointer" : "/nodes/1"
  }, {
    "id" : "class-order-line",
    "source_id" : "class-order-line",
    "projection_id" : "class-order-line",
    "x" : 476.5248107910156,
    "y" : 44.0,
    "width" : 220.0,
    "height" : 120.0,
    "label" : "OrderLine",
    "source_pointer" : "/nodes/3"
  }, {
    "id" : "enum-order-status",
    "source_id" : "enum-order-status",
    "projection_id" : "enum-order-status",
    "x" : 476.5248107910156,
    "y" : 236.0,
    "width" : 220.0,
    "height" : 120.0,
    "label" : "OrderStatus",
    "source_pointer" : "/nodes/2"
  } ],
  "edges" : [ {
    "id" : "order-has-lines",
    "source" : "class-order",
    "target" : "class-order-line",
    "source_id" : "order-has-lines",
    "projection_id" : "order-has-lines",
    "routing_hints" : [ ],
    "route" : {
      "kind" : "polyline",
      "points" : [ {
        "x" : 265.0,
        "y" : 104.0
      }, {
        "x" : 475.5248107910156,
        "y" : 104.0
      } ]
    },
    "label" : "lines",
    "source_pointer" : "/relationships/0"
  }, {
    "id" : "order-status-dependency",
    "source" : "class-order",
    "target" : "enum-order-status",
    "source_id" : "order-status-dependency",
    "projection_id" : "order-status-dependency",
    "routing_hints" : [ ],
    "route" : {
      "kind" : "polyline",
      "points" : [ {
        "x" : 265.0,
        "y" : 145.0
      }, {
        "x" : 313.0,
        "y" : 145.0
      }, {
        "x" : 313.0,
        "y" : 296.0
      }, {
        "x" : 475.5248107910156,
        "y" : 296.0
      } ]
    },
    "label" : "uses",
    "source_pointer" : "/relationships/1"
  } ],
  "groups" : [ {
    "id" : "orders-package-boundary",
    "source_id" : "pkg-orders",
    "projection_id" : "orders-package-boundary",
    "provenance" : {
      "semantic_backed" : {
        "source_id" : "pkg-orders"
      }
    },
    "x" : 12.0,
    "y" : 12.0,
    "width" : 716.5247802734375,
    "height" : 376.0,
    "members" : [ "class-order", "class-order-line", "enum-order-status" ],
    "label" : "Orders"
  } ],
  "warnings" : [ ]
}
