{
  "layout_result_schema_version" : "layout-result.schema.v3",
  "view_id" : "activity-view",
  "nodes" : [ {
    "id" : "initial-submit",
    "source_id" : "initial-submit",
    "projection_id" : "initial-submit",
    "x" : 12.0,
    "y" : 12.0,
    "width" : 32.0,
    "height" : 119.0,
    "label" : "",
    "source_pointer" : "/nodes/5"
  }, {
    "id" : "action-enter-order",
    "source_id" : "action-enter-order",
    "projection_id" : "action-enter-order",
    "x" : 142.0,
    "y" : 12.0,
    "width" : 160.0,
    "height" : 119.0,
    "label" : "Enter order",
    "source_pointer" : "/nodes/6"
  }, {
    "id" : "decision-valid",
    "source_id" : "decision-valid",
    "projection_id" : "decision-valid",
    "x" : 400.0,
    "y" : 12.0,
    "width" : 32.0,
    "height" : 119.0,
    "label" : "Valid?",
    "source_pointer" : "/nodes/7"
  }, {
    "id" : "action-submit",
    "source_id" : "action-submit",
    "projection_id" : "action-submit",
    "x" : 659.96240234375,
    "y" : 12.0,
    "width" : 160.0,
    "height" : 119.0,
    "label" : "Submit",
    "source_pointer" : "/nodes/8"
  }, {
    "id" : "final-submit",
    "source_id" : "final-submit",
    "projection_id" : "final-submit",
    "x" : 917.96240234375,
    "y" : 12.0,
    "width" : 32.0,
    "height" : 119.0,
    "label" : "",
    "source_pointer" : "/nodes/9"
  } ],
  "edges" : [ {
    "id" : "flow-start-enter",
    "source" : "initial-submit",
    "target" : "action-enter-order",
    "source_id" : "flow-start-enter",
    "projection_id" : "flow-start-enter",
    "routing_hints" : [ ],
    "route" : {
      "kind" : "polyline",
      "points" : [ {
        "x" : 45.0,
        "y" : 71.5
      }, {
        "x" : 141.0,
        "y" : 71.5
      } ]
    },
    "label" : "",
    "source_pointer" : "/relationships/2"
  }, {
    "id" : "flow-enter-valid",
    "source" : "action-enter-order",
    "target" : "decision-valid",
    "source_id" : "flow-enter-valid",
    "projection_id" : "flow-enter-valid",
    "routing_hints" : [ ],
    "route" : {
      "kind" : "polyline",
      "points" : [ {
        "x" : 303.0,
        "y" : 71.5
      }, {
        "x" : 399.0,
        "y" : 71.5
      } ]
    },
    "label" : "",
    "source_pointer" : "/relationships/3"
  }, {
    "id" : "flow-valid-submit",
    "source" : "decision-valid",
    "target" : "action-submit",
    "source_id" : "flow-valid-submit",
    "projection_id" : "flow-valid-submit",
    "routing_hints" : [ ],
    "route" : {
      "kind" : "polyline",
      "points" : [ {
        "x" : 433.0,
        "y" : 71.5
      }, {
        "x" : 658.96240234375,
        "y" : 71.5
      } ]
    },
    "label" : "yes",
    "source_pointer" : "/relationships/4"
  }, {
    "id" : "flow-submit-final",
    "source" : "action-submit",
    "target" : "final-submit",
    "source_id" : "flow-submit-final",
    "projection_id" : "flow-submit-final",
    "routing_hints" : [ ],
    "route" : {
      "kind" : "polyline",
      "points" : [ {
        "x" : 820.96240234375,
        "y" : 71.5
      }, {
        "x" : 916.96240234375,
        "y" : 71.5
      } ]
    },
    "label" : "",
    "source_pointer" : "/relationships/5"
  } ],
  "groups" : [ ],
  "warnings" : [ ]
}
