{
  "layout_result_schema_version" : "layout-result.schema.v3",
  "view_id" : "deployment-view",
  "nodes" : [ {
    "id" : "device-prod-node",
    "source_id" : "device-prod-node",
    "projection_id" : "device-prod-node",
    "x" : 213.5,
    "y" : 12.0,
    "width" : 200.0,
    "height" : 120.0,
    "label" : "Production Node",
    "source_pointer" : "/nodes/0"
  }, {
    "id" : "ee-orders-runtime",
    "source_id" : "ee-orders-runtime",
    "projection_id" : "ee-orders-runtime",
    "x" : 378.0,
    "y" : 713.0,
    "width" : 180.0,
    "height" : 96.0,
    "label" : "Orders Runtime",
    "source_pointer" : "/nodes/1"
  }, {
    "id" : "node-payment-network",
    "source_id" : "node-payment-network",
    "projection_id" : "node-payment-network",
    "x" : 760.0,
    "y" : 701.0,
    "width" : 200.0,
    "height" : 120.0,
    "label" : "Payment Network",
    "source_pointer" : "/nodes/2"
  }, {
    "id" : "artifact-orders-service",
    "source_id" : "artifact-orders-service",
    "projection_id" : "artifact-orders-service",
    "x" : 83.0,
    "y" : 378.0,
    "width" : 150.0,
    "height" : 70.0,
    "label" : "orders-service.jar",
    "source_pointer" : "/nodes/3"
  }, {
    "id" : "artifact-migration-job",
    "source_id" : "artifact-migration-job",
    "projection_id" : "artifact-migration-job",
    "x" : 64.0,
    "y" : 236.0,
    "width" : 150.0,
    "height" : 70.0,
    "label" : "migration-job.jar",
    "source_pointer" : "/nodes/4"
  }, {
    "id" : "deployment-spec-orders",
    "source_id" : "deployment-spec-orders",
    "projection_id" : "deployment-spec-orders",
    "x" : 44.0,
    "y" : 545.0,
    "width" : 190.0,
    "height" : 70.0,
    "label" : "orders-deployment.yaml",
    "source_pointer" : "/nodes/5"
  }, {
    "id" : "component-order-api",
    "source_id" : "component-order-api",
    "projection_id" : "component-order-api",
    "x" : 760.0,
    "y" : 365.0,
    "width" : 180.0,
    "height" : 96.0,
    "label" : "Order API",
    "source_pointer" : "/nodes/6"
  } ],
  "edges" : [ {
    "id" : "deploy-orders-service",
    "source" : "artifact-orders-service",
    "target" : "ee-orders-runtime",
    "source_id" : "deploy-orders-service",
    "projection_id" : "deploy-orders-service",
    "routing_hints" : [ ],
    "route" : {
      "kind" : "polyline",
      "points" : [ {
        "x" : 158.0,
        "y" : 449.0
      }, {
        "x" : 158.0,
        "y" : 497.0
      }, {
        "x" : 494.1666666666667,
        "y" : 497.0
      }, {
        "x" : 494.1666666666667,
        "y" : 712.0
      } ]
    },
    "label" : "deploy",
    "source_pointer" : "/relationships/0"
  }, {
    "id" : "deploy-orders-spec",
    "source" : "deployment-spec-orders",
    "target" : "ee-orders-runtime",
    "source_id" : "deploy-orders-spec",
    "projection_id" : "deploy-orders-spec",
    "routing_hints" : [ ],
    "route" : {
      "kind" : "polyline",
      "points" : [ {
        "x" : 139.0,
        "y" : 616.0
      }, {
        "x" : 139.0,
        "y" : 664.0
      }, {
        "x" : 441.8333333333333,
        "y" : 664.0
      }, {
        "x" : 441.8333333333333,
        "y" : 712.0
      } ]
    },
    "label" : "applies",
    "source_pointer" : "/relationships/1"
  }, {
    "id" : "artifact-manifests-order-api",
    "source" : "artifact-orders-service",
    "target" : "component-order-api",
    "source_id" : "artifact-manifests-order-api",
    "projection_id" : "artifact-manifests-order-api",
    "routing_hints" : [ ],
    "route" : {
      "kind" : "polyline",
      "points" : [ {
        "x" : 234.0,
        "y" : 413.0
      }, {
        "x" : 759.0,
        "y" : 413.0
      } ]
    },
    "label" : "manifests",
    "source_pointer" : "/relationships/2"
  }, {
    "id" : "orders-runtime-payment-path",
    "source" : "ee-orders-runtime",
    "target" : "node-payment-network",
    "source_id" : "orders-runtime-payment-path",
    "projection_id" : "orders-runtime-payment-path",
    "routing_hints" : [ ],
    "route" : {
      "kind" : "polyline",
      "points" : [ {
        "x" : 559.0,
        "y" : 761.0
      }, {
        "x" : 759.0,
        "y" : 761.0
      } ]
    },
    "label" : "HTTPS",
    "source_pointer" : "/relationships/3"
  } ],
  "groups" : [ {
    "id" : "prod-node-boundary",
    "source_id" : "device-prod-node",
    "projection_id" : "prod-node-boundary",
    "provenance" : {
      "semantic_backed" : {
        "source_id" : "device-prod-node"
      }
    },
    "x" : 12.0,
    "y" : 204.0,
    "width" : 579.0,
    "height" : 637.0,
    "members" : [ "ee-orders-runtime", "artifact-orders-service", "artifact-migration-job", "deployment-spec-orders" ],
    "label" : "Production Node"
  } ],
  "warnings" : [ ]
}
