{
  "layout_result_schema_version" : "layout-result.schema.v3",
  "view_id" : "sequence-view",
  "nodes" : [ {
    "id" : "interaction-self-message",
    "source_id" : "interaction-self-message",
    "projection_id" : "interaction-self-message",
    "x" : 101.0,
    "y" : 292.0,
    "width" : 540.9684143066406,
    "height" : 176.0,
    "label" : "Validate Order",
    "role" : "interaction",
    "source_pointer" : "/nodes/0"
  }, {
    "id" : "customer",
    "source_id" : "customer",
    "projection_id" : "customer",
    "x" : 101.0,
    "y" : 292.0,
    "width" : 140.0,
    "height" : 64.0,
    "label" : "Customer",
    "role" : "lifeline",
    "source_pointer" : "/nodes/1"
  }, {
    "id" : "service",
    "source_id" : "service",
    "projection_id" : "service",
    "x" : 501.9684143066406,
    "y" : 292.0,
    "width" : 140.0,
    "height" : 64.0,
    "label" : "Order Service",
    "role" : "lifeline",
    "source_pointer" : "/nodes/2"
  } ],
  "edges" : [ {
    "id" : "m1",
    "source" : "customer",
    "target" : "service",
    "source_id" : "m1",
    "projection_id" : "m1",
    "routing_hints" : [ ],
    "route" : {
      "kind" : "polyline",
      "points" : [ {
        "x" : 171.0,
        "y" : 380.0
      }, {
        "x" : 571.9684143066406,
        "y" : 380.0
      } ]
    },
    "label" : "placeOrder",
    "source_pointer" : "/relationships/0"
  }, {
    "id" : "m2",
    "source" : "service",
    "target" : "service",
    "source_id" : "m2",
    "projection_id" : "m2",
    "routing_hints" : [ ],
    "route" : {
      "kind" : "polyline",
      "points" : [ {
        "x" : 571.9684143066406,
        "y" : 412.0
      }, {
        "x" : 611.9684143066406,
        "y" : 412.0
      }, {
        "x" : 611.9684143066406,
        "y" : 436.0
      }, {
        "x" : 571.9684143066406,
        "y" : 436.0
      } ]
    },
    "label" : "validateOrder",
    "source_pointer" : "/relationships/1"
  }, {
    "id" : "m3",
    "source" : "service",
    "target" : "customer",
    "source_id" : "m3",
    "projection_id" : "m3",
    "routing_hints" : [ ],
    "route" : {
      "kind" : "polyline",
      "points" : [ {
        "x" : 571.9684143066406,
        "y" : 468.0
      }, {
        "x" : 171.0,
        "y" : 468.0
      } ]
    },
    "label" : "orderConfirmed",
    "source_pointer" : "/relationships/2"
  } ],
  "groups" : [ ],
  "warnings" : [ ]
}
