{
  "layout_result_schema_version" : "layout-result.schema.v3",
  "view_id" : "main",
  "nodes" : [ {
    "id" : "client",
    "source_id" : "client",
    "projection_id" : "client",
    "x" : 12.0,
    "y" : 61.0,
    "width" : 160.0,
    "height" : 80.0,
    "label" : "Client",
    "source_pointer" : "/nodes/0"
  }, {
    "id" : "web-app",
    "source_id" : "web-app",
    "projection_id" : "web-app",
    "x" : 393.2778015136719,
    "y" : 61.0,
    "width" : 160.0,
    "height" : 80.0,
    "label" : "Web App",
    "source_pointer" : "/nodes/1"
  }, {
    "id" : "orders-api",
    "source_id" : "orders-api",
    "projection_id" : "orders-api",
    "x" : 705.1838073730469,
    "y" : 40.5,
    "width" : 160.0,
    "height" : 121.0,
    "label" : "Orders API",
    "source_pointer" : "/nodes/2"
  }, {
    "id" : "database",
    "source_id" : "database",
    "projection_id" : "database",
    "x" : 1678.394287109375,
    "y" : 51.25,
    "width" : 160.0,
    "height" : 96.0,
    "label" : "PostgreSQL",
    "source_pointer" : "/nodes/3"
  }, {
    "id" : "worker",
    "source_id" : "worker",
    "projection_id" : "worker",
    "x" : 1123.5487976074219,
    "y" : 36.0,
    "width" : 160.0,
    "height" : 80.0,
    "label" : "Fulfillment Worker",
    "source_pointer" : "/nodes/4"
  }, {
    "id" : "payments",
    "source_id" : "payments",
    "projection_id" : "payments",
    "x" : 1678.394287109375,
    "y" : 187.25,
    "width" : 160.0,
    "height" : 80.0,
    "label" : "Payment Authorization Service",
    "source_pointer" : "/nodes/5"
  } ],
  "edges" : [ {
    "id" : "client-submits-order",
    "source" : "client",
    "target" : "web-app",
    "source_id" : "client-submits-order",
    "projection_id" : "client-submits-order",
    "routing_hints" : [ ],
    "route" : {
      "kind" : "polyline",
      "points" : [ {
        "x" : 173.0,
        "y" : 101.0
      }, {
        "x" : 392.2778015136719,
        "y" : 101.0
      } ]
    },
    "label" : "submits order",
    "source_pointer" : "/relationships/0"
  }, {
    "id" : "web-app-calls-api",
    "source" : "web-app",
    "target" : "orders-api",
    "source_id" : "web-app-calls-api",
    "projection_id" : "web-app-calls-api",
    "routing_hints" : [ ],
    "route" : {
      "kind" : "polyline",
      "points" : [ {
        "x" : 554.2778015136719,
        "y" : 101.0
      }, {
        "x" : 704.1838073730469,
        "y" : 101.0
      } ]
    },
    "label" : "calls API",
    "source_pointer" : "/relationships/1"
  }, {
    "id" : "api-writes-database",
    "source" : "orders-api",
    "target" : "database",
    "source_id" : "api-writes-database",
    "projection_id" : "api-writes-database",
    "routing_hints" : [ ],
    "route" : {
      "kind" : "polyline",
      "points" : [ {
        "x" : 866.1838073730469,
        "y" : 101.0
      }, {
        "x" : 914.1838073730469,
        "y" : 101.0
      }, {
        "x" : 914.1838073730469,
        "y" : 140.0
      }, {
        "x" : 1344.548828125,
        "y" : 140.0
      }, {
        "x" : 1344.548828125,
        "y" : 111.75
      }, {
        "x" : 1677.394287109375,
        "y" : 111.75
      } ]
    },
    "label" : "writes orders",
    "source_pointer" : "/relationships/2"
  }, {
    "id" : "api-authorizes-payment",
    "source" : "orders-api",
    "target" : "payments",
    "source_id" : "api-authorizes-payment",
    "projection_id" : "api-authorizes-payment",
    "routing_hints" : [ ],
    "route" : {
      "kind" : "polyline",
      "points" : [ {
        "x" : 866.1838073730469,
        "y" : 126.0
      }, {
        "x" : 890.1838073730469,
        "y" : 126.0
      }, {
        "x" : 890.1838073730469,
        "y" : 227.25
      }, {
        "x" : 1677.394287109375,
        "y" : 227.25
      } ]
    },
    "label" : "requests payment authorization",
    "source_pointer" : "/relationships/3"
  }, {
    "id" : "api-publishes-job",
    "source" : "orders-api",
    "target" : "worker",
    "source_id" : "api-publishes-job",
    "projection_id" : "api-publishes-job",
    "routing_hints" : [ ],
    "route" : {
      "kind" : "polyline",
      "points" : [ {
        "x" : 866.1838073730469,
        "y" : 76.0
      }, {
        "x" : 1122.5487976074219,
        "y" : 76.0
      } ]
    },
    "label" : "publishes fulfillment",
    "source_pointer" : "/relationships/4"
  }, {
    "id" : "worker-reads-database",
    "source" : "worker",
    "target" : "database",
    "source_id" : "worker-reads-database",
    "projection_id" : "worker-reads-database",
    "routing_hints" : [ ],
    "route" : {
      "kind" : "polyline",
      "points" : [ {
        "x" : 1284.5487976074219,
        "y" : 76.0
      }, {
        "x" : 1344.548828125,
        "y" : 76.0
      }, {
        "x" : 1344.548828125,
        "y" : 86.75
      }, {
        "x" : 1677.394287109375,
        "y" : 86.75
      } ]
    },
    "label" : "loads order",
    "source_pointer" : "/relationships/5"
  } ],
  "groups" : [ {
    "id" : "application-services",
    "source_id" : "application-services",
    "projection_id" : "application-services",
    "provenance" : {
      "semantic_backed" : {
        "source_id" : "application-services"
      }
    },
    "x" : 368.2778015136719,
    "y" : 12.0,
    "width" : 940.27099609375,
    "height" : 189.0,
    "members" : [ "web-app", "orders-api", "worker" ],
    "label" : "Application Services"
  }, {
    "id" : "external-dependencies",
    "source_id" : "external-dependencies",
    "projection_id" : "external-dependencies",
    "provenance" : {
      "semantic_backed" : {
        "source_id" : "external-dependencies"
      }
    },
    "x" : 1653.394287109375,
    "y" : 27.25,
    "width" : 209.0,
    "height" : 264.0,
    "members" : [ "payments", "database" ],
    "label" : "External Dependencies"
  } ],
  "warnings" : [ ]
}
